[
  {
    "screen_id": "public_entry",
    "state": "loading",
    "title": "Preparando la entrada a VipWeb.",
    "body": "Estamos cargando el contexto público mínimo sin acceder a datos privados.",
    "primary_action": "",
    "secondary_action": "",
    "tone": "calm_actionable",
    "source_doc": "docs/07-design-ux/09-screen-state-copy.md"
  },
  {
    "screen_id": "public_entry",
    "state": "empty",
    "title": "VipWeb es un ecosistema modular de acompañamiento.",
    "body": "Desde aquí puedes entender el propósito del sistema e iniciar sesión con una cuenta provisionada. No hay auto-registro público en el MVP.",
    "primary_action": "Iniciar sesión",
    "secondary_action": "Acceso mediante cuenta provisionada",
    "tone": "calm_actionable",
    "source_doc": "docs/07-design-ux/09-screen-state-copy.md"
  },
  {
    "screen_id": "public_entry",
    "state": "ready",
    "title": "Tu punto de entrada al ecosistema VipWeb.",
    "body": "Continúa hacia el acceso seguro para retomar módulos, progreso y próximos pasos cuando tengas una cuenta provisionada.",
    "primary_action": "Iniciar sesión",
    "secondary_action": "",
    "tone": "calm_actionable",
    "source_doc": "docs/07-design-ux/09-screen-state-copy.md"
  },
  {
    "screen_id": "public_entry",
    "state": "error",
    "title": "No se ha podido cargar la entrada pública.",
    "body": "Puedes intentar acceder de nuevo al punto de entrada o ir directamente al inicio de sesión.",
    "primary_action": "Reintentar",
    "secondary_action": "Ir a login",
    "tone": "calm_actionable",
    "source_doc": "docs/07-design-ux/09-screen-state-copy.md"
  },
  {
    "screen_id": "login",
    "state": "empty",
    "title": "Accede para continuar tu espacio.",
    "body": "Introduce tus datos para retomar tu ecosistema.",
    "primary_action": "Entrar",
    "secondary_action": "",
    "tone": "calm_actionable",
    "source_doc": "docs/07-design-ux/09-screen-state-copy.md"
  },
  {
    "screen_id": "login",
    "state": "loading",
    "title": "Comprobando tus datos de acceso.",
    "body": "La sesión se preparará si las credenciales son correctas.",
    "primary_action": "",
    "secondary_action": "",
    "tone": "calm_actionable",
    "source_doc": "docs/07-design-ux/09-screen-state-copy.md"
  },
  {
    "screen_id": "login",
    "state": "error",
    "title": "No se ha podido iniciar sesión.",
    "body": "Revisa los datos e inténtalo de nuevo.",
    "primary_action": "Reintentar",
    "secondary_action": "",
    "tone": "calm_actionable",
    "source_doc": "docs/07-design-ux/09-screen-state-copy.md"
  },
  {
    "screen_id": "login",
    "state": "success",
    "title": "Sesión iniciada.",
    "body": "Preparando tu panel.",
    "primary_action": "Continuar",
    "secondary_action": "",
    "tone": "calm_actionable",
    "source_doc": "docs/07-design-ux/09-screen-state-copy.md"
  },
  {
    "screen_id": "onboarding",
    "state": "loading",
    "title": "Leyendo tu progreso de configuración.",
    "body": "Estamos recuperando el último paso disponible para continuar sin perder contexto.",
    "primary_action": "",
    "secondary_action": "",
    "tone": "calm_actionable",
    "source_doc": "docs/07-design-ux/09-screen-state-copy.md"
  },
  {
    "screen_id": "onboarding",
    "state": "empty",
    "title": "Vamos a preparar tu espacio paso a paso.",
    "body": "Completa la configuración inicial para activar la experiencia guiada.",
    "primary_action": "Empezar",
    "secondary_action": "",
    "tone": "calm_actionable",
    "source_doc": "docs/07-design-ux/09-screen-state-copy.md"
  },
  {
    "screen_id": "onboarding",
    "state": "in_progress",
    "title": "Continúa desde el último punto completado.",
    "body": "Tu avance se conserva automáticamente cuando guardas cada paso.",
    "primary_action": "Continuar",
    "secondary_action": "Guardar y salir",
    "tone": "calm_actionable",
    "source_doc": "docs/07-design-ux/09-screen-state-copy.md"
  },
  {
    "screen_id": "onboarding",
    "state": "paused",
    "title": "Puedes retomarlo cuando quieras.",
    "body": "Tu avance se conserva y no bloquea volver al panel básico.",
    "primary_action": "Retomar",
    "secondary_action": "Ir al panel",
    "tone": "calm_actionable",
    "source_doc": "docs/07-design-ux/09-screen-state-copy.md"
  },
  {
    "screen_id": "onboarding",
    "state": "completed",
    "title": "Configuración inicial completada.",
    "body": "Tu espacio ya tiene la base necesaria para continuar.",
    "primary_action": "Ir al panel",
    "secondary_action": "",
    "tone": "calm_actionable",
    "source_doc": "docs/07-design-ux/09-screen-state-copy.md"
  },
  {
    "screen_id": "onboarding",
    "state": "error",
    "title": "No se ha podido guardar este paso.",
    "body": "Revisa la información y vuelve a intentarlo.",
    "primary_action": "Reintentar",
    "secondary_action": "Guardar más tarde",
    "tone": "calm_actionable",
    "source_doc": "docs/07-design-ux/09-screen-state-copy.md"
  },
  {
    "screen_id": "dashboard",
    "state": "loading",
    "title": "Preparando el resumen de tu ecosistema.",
    "body": "Estamos leyendo módulos, progreso y avisos disponibles.",
    "primary_action": "",
    "secondary_action": "",
    "tone": "calm_actionable",
    "source_doc": "docs/07-design-ux/09-screen-state-copy.md"
  },
  {
    "screen_id": "dashboard",
    "state": "empty",
    "title": "Todavía no hay actividad.",
    "body": "El siguiente paso recomendado es completar la configuración inicial.",
    "primary_action": "Continuar configuración",
    "secondary_action": "",
    "tone": "calm_actionable",
    "source_doc": "docs/07-design-ux/09-screen-state-copy.md"
  },
  {
    "screen_id": "dashboard",
    "state": "ready",
    "title": "Tu espacio está listo para continuar.",
    "body": "Revisa el siguiente paso sugerido y los módulos disponibles.",
    "primary_action": "Ver siguiente paso",
    "secondary_action": "",
    "tone": "calm_actionable",
    "source_doc": "docs/07-design-ux/09-screen-state-copy.md"
  },
  {
    "screen_id": "dashboard",
    "state": "blocked",
    "title": "Hay una fase previa pendiente.",
    "body": "Completa la base técnica antes de mostrar este panel completo.",
    "primary_action": "Ver requisitos",
    "secondary_action": "",
    "tone": "calm_actionable",
    "source_doc": "docs/07-design-ux/09-screen-state-copy.md"
  },
  {
    "screen_id": "dashboard",
    "state": "error",
    "title": "No se ha podido cargar el panel.",
    "body": "Revisa Doctor o inténtalo de nuevo.",
    "primary_action": "Reintentar",
    "secondary_action": "Ver Doctor",
    "tone": "calm_actionable",
    "source_doc": "docs/07-design-ux/09-screen-state-copy.md"
  },
  {
    "screen_id": "profile",
    "state": "loading",
    "title": "Preparando tu perfil.",
    "body": "Estamos leyendo tus datos y preferencias permitidas.",
    "primary_action": "",
    "secondary_action": "",
    "tone": "calm_actionable",
    "source_doc": "docs/07-design-ux/09-screen-state-copy.md"
  },
  {
    "screen_id": "profile",
    "state": "view",
    "title": "Estos son los datos principales de tu perfil.",
    "body": "Revísalos antes de actualizar contexto o preferencias.",
    "primary_action": "Editar",
    "secondary_action": "",
    "tone": "calm_actionable",
    "source_doc": "docs/07-design-ux/09-screen-state-copy.md"
  },
  {
    "screen_id": "profile",
    "state": "edit",
    "title": "Actualiza solo lo necesario.",
    "body": "Podrás cambiarlo más adelante sin perder continuidad.",
    "primary_action": "Guardar",
    "secondary_action": "Cancelar",
    "tone": "calm_actionable",
    "source_doc": "docs/07-design-ux/09-screen-state-copy.md"
  },
  {
    "screen_id": "profile",
    "state": "saving",
    "title": "Guardando cambios.",
    "body": "No cierres esta pantalla hasta finalizar el guardado.",
    "primary_action": "",
    "secondary_action": "",
    "tone": "calm_actionable",
    "source_doc": "docs/07-design-ux/09-screen-state-copy.md"
  },
  {
    "screen_id": "profile",
    "state": "saved",
    "title": "Perfil actualizado correctamente.",
    "body": "Los módulos podrán usar el nuevo contexto permitido.",
    "primary_action": "Volver",
    "secondary_action": "",
    "tone": "calm_actionable",
    "source_doc": "docs/07-design-ux/09-screen-state-copy.md"
  },
  {
    "screen_id": "profile",
    "state": "blocked",
    "title": "No se puede mostrar el perfil todavía.",
    "body": "Falta permiso, sesión válida o una fase previa para acceder a esta pantalla.",
    "primary_action": "Volver al panel",
    "secondary_action": "",
    "tone": "calm_actionable",
    "source_doc": "docs/07-design-ux/09-screen-state-copy.md"
  },
  {
    "screen_id": "profile",
    "state": "error",
    "title": "No se han podido guardar los cambios.",
    "body": "Revisa los campos marcados y vuelve a intentarlo.",
    "primary_action": "Reintentar",
    "secondary_action": "Descartar",
    "tone": "calm_actionable",
    "source_doc": "docs/07-design-ux/09-screen-state-copy.md"
  },
  {
    "screen_id": "notifications",
    "state": "loading",
    "title": "Cargando tus avisos.",
    "body": "Estamos revisando si hay notificaciones pendientes o ya leídas.",
    "primary_action": "",
    "secondary_action": "",
    "tone": "calm_actionable",
    "source_doc": "docs/07-design-ux/09-screen-state-copy.md"
  },
  {
    "screen_id": "notifications",
    "state": "empty",
    "title": "No hay avisos pendientes.",
    "body": "Cuando algo requiera atención aparecerá aquí.",
    "primary_action": "Volver al panel",
    "secondary_action": "",
    "tone": "calm_actionable",
    "source_doc": "docs/07-design-ux/09-screen-state-copy.md"
  },
  {
    "screen_id": "notifications",
    "state": "unread",
    "title": "Tienes avisos por revisar.",
    "body": "Marca como leídos los que ya no requieran acción.",
    "primary_action": "Revisar",
    "secondary_action": "",